,regno,answers
0,0009,"['Compulär Organisation 91003)\n', 'and Architecture.\n', 'Pratheefisha P. kumar\n', '$4 CSE . Roll no: 37\n', 'Program . It\n', 'counter (PC) consists of\n', 'the\n', 'address\n', 'location\n', 'of\n', 'the\n', 'prouss\n', 'that\n', 'is\n', 'to be\n', 'executed\n', 'in\n', 'the\n', 'next.\n', 'step\n', 'Instruchón Register: I instruchon regiscen - instruction that is being\n', 'consists of\n', 'the actres\n', 'executed.\n', 'The IR\n', 'generates\n', 'timing\n', 'signals\n', 'Byte addressable memory :- Memory millions of semicondisctor wis , each can skre i byle design b y\n', 'consists of\n', 'of which\n', '2*\n', 'locations"":\n', 'time\n', 'where 25. no. of bytes\n', 'collection\n', 'of\n', 'an bytes\n', 'are\n', 'called\n', 'a\n', 'word\n', 'o\n']"
1,0009,"['Big - endian\n', 'byte assignment:\n', 'in this type of byte assigment; the most significant bit (MSB) is written at chi first end and hence called e; the\n', 'bit position and is hence called Big endian biste assignment\n', 'highest\n', 'che no code\n', '4505\n', 'for og: in big-endian is written as\n', '4F 05\n', 'B\n', 'Here\n', 'the\n', 'most\n', 'significant\n', 'digit\n', '4F is\n', 'written\n', 'at\n', 'the\n', 'highest\n', 'bit\n', 'position\n', 'de\n', 'Little-endian\n', 'byte aus ignment\n', 'In this type of bile assignment, the least significant bit masis) is written at the test end e; the highest bit positions Little endicin byl assignment. ☺ the defect reverse of tette endian byre asignment\n', '.\n', 'big\n', '.\n', 'ur\n', 'os 4605 is\n', 'written\n', 'as\n', '054F in\n', 'rettle enchan\n', 'assignment.\n']"
2,0009,"['o condition codes. * baad R Load (loc al RA..\n', 'This condition is used to copy the intents of location : A to the register Rg. This will I remain a copy of the content at location. A\n', 'lits inhal position) also .\n', '• Add {R,], R₂\n', '1. Add the\n', 'contents inside\n', 'R, and\n', 'R2 and\n', 'store\n', 'the result\n', 'in\n', 'R2 .\n']"
3,0009,"['Different addressing\n', 'modes:\n', '-\n', 'register .\n', 'Three\n', 'warrabta\n', 'addressing\n', 'modes:\n', 'It\n', 'consists\n', 'registers\n', 'for\n', 'a\n', 'of three command.\n', 'vanable\n', '.\n', 'adreesing\n', 'a\n', ':\n', '.\n', '.\n', 'eg:\n', 'Add. R., R2, R3.\n', '- R2, Rz.\n', 'It\n', 'means\n', 'Add\n', 'the contents of\n', 'Re\n', 'and\n', 'R₂\n', 'and\n', 'store\n', 'in\n', 'Rz. the\n', 'result\n', 'in Ro\n', '3\n', 'Two\n', 'reanten variable\n', 'address ina\n', 'modes\n', '.\n', 'It consists of two vanable registers for landelveiring or executing a commanel\n', 'eg i\n', 'Aeld Ri, R2\n', 'hela Ri, R\n', 'it\n', 'means\n', 'to\n', 'Add\n', 'the\n', 'contents\n', 'of\n', 'store the\n', 'result\n', '- R\n', 'inofele\n', 'and R₂ and\n', 'Rę itself\n']"
4,0009,"['-\n', 'Single registén a ddressing mode:\n', 'It consists of a single vanable register ad chreuring a command - eg: Add Ri\n', 'for\n', 'of\n', 'it means Rp with\n', 'that the\n', 'add content\n', 'the value\n', 'inside the\n', 'cenlents of accumilator.\n', '5)\n', '1. PC out, MARA, Yin, Addly, Zout.\n', '2.\n', 'Zin\n', 'Select Y.\n', 'Add Zin,\n']"
